常用词语释义,,
公司、本公司,指,河北福成五丰食品股份有限公司
福成集团,指,福成投资集团有限公司
福生投资,指,三河福生投资有限公司
润成典当,指,北京市润成典当有限责任公司
餐饮公司,指,福成肥牛餐饮管理有限公司
灵山宝塔陵园,指,三河灵山宝塔陵园有限公司
福成生物科技,指,三河福成生物科技有限公司
粮润生态农业,指,三河市粮润生态农业专业合作社
天德福地陵园、韶山公司,指,湖南韶山天德福地陵园有限责任公司
福成控股,指,三河福成控股有限公司
和辉基金,指,深圳市福成和辉产业发展投资企业（有限合伙）
福成房地产,指,河北福成房地产开发有限公司
福成酿酒,指,三河市福成酿酒有限公司
福成商贸,指,三河福成商贸有限公司
润成小额贷款,指,三河市润成小额贷款有限公司
福成大酒店,指,福成国际大酒店有限公司
润旭房地产,指,三河市润旭房地产开发有限公司
和鑫汽车,指,三河市和鑫汽车销售有限公司
福成优选,指,三河市福成优选电子商务有限公司
永兴水泥,指,三河市永兴水泥制品有限公司
隆盛物业,指,三河市隆盛物业服务有限公司
兴隆运输,指,三河市兴隆运输有限公司
福兴物业,指,三河市福兴物业服务有限公司
福成新型建材,指,兴隆县福成新型建材有限公司
金天地生态农业,指,三河市金天地生态农业专业合作社
晟良门窗,指,三河市晟良门窗生产安装有限公司
一福一城物业,指,三河市一福一城物业服务有限公司
一福一城电子商务,指,三河一福一城电子商务有限公司
一福一城俱乐部,指,三河市福成一福一城俱乐部有限公司
易创广告,指,三河市易创广告有限公司
友邻网络,指,三河市友邻网络科技有限公司
润景房地产,指,三河润景房地产开发有限责任公司
润堂小额贷款,指,三河市润堂科技小额贷款有限公司
勇润建筑,指,三河市勇润建筑工程有限公司
隆泰物流,指,三河市隆泰物流有限公司
燕山娱乐,指,三河燕山福成娱乐有限公司
本报告期、本期,指,2025 年1 月1 日至2025 年12 月31 日
上年同期、上期,指,2024 年1 月1 日至2024 年12 月31 日
